date	run_id	spec	change	score	prev_best	verdict
2026-08-20	32425712387	s01	builder=failure reviewer=skipped	0	0	DISCARD
2026-08-20	32426645432	s01	builder=failure reviewer=skipped	0	0	DISCARD
2026-08-20	32428580868	s01	Add Supabase schema SQL, validateReading/loadSchemaSql module, and full jest test suite for s01. 	17	0	KEEP
2026-08-21	32441762179	s02	Add s02 Terra sandbox client (connect/disconnect users, webhook validation/normalization) with full jest coverage. 	37	17	KEEP
2026-08-22	32547365952	s02	Add Terra webhook fixtures and an in-memory sandbox EventLog with replay/filtering, plus new tests. 	58	37	DISCARD
2026-08-23	32614178222	s02	Rewrote s02 sandbox client with connect/disconnect, webhook validate/normalize, and a tested EventLog module. 	62	37	KEEP
2026-08-24	32684877129	s02	builder=failure reviewer=skipped	0	62	DISCARD
2026-08-25	32803207272	s02	Rewrote s02 sandbox client/tests with batch ingestion and a Terra webhook JSON schema export. 	77	62	KEEP
2026-08-26	32924885295	s02	builder=failure reviewer=skipped	0	77	DISCARD
2026-08-27	33071269260	s02	builder=failure reviewer=skipped	0	77	DISCARD
2026-08-28	33176793817	s02	Rewrote self-contained s02 Terra sandbox client and tests with batch ingestion, EventLog, and provider aggregation. 	51	77	DISCARD
2026-08-29	33243547035	s02	builder=failure reviewer=skipped	0	77	DISCARD
2026-08-30	33300107405	s02	builder=failure reviewer=skipped	0	77	DISCARD
2026-08-31	33371167432	s02	builder=failure reviewer=skipped	0	77	DISCARD
2026-09-01	33481049006	s02	builder=failure reviewer=skipped	0	77	DISCARD
2026-09-02	33600371764	s02	builder=failure reviewer=skipped	0	77	DISCARD
2026-09-03	33725021947	s02	builder=failure reviewer=skipped	0	77	DISCARD
2026-09-04	33846323625	s02	builder=failure reviewer=skipped	0	77	DISCARD
2026-09-05	33950399434	s02	builder=failure reviewer=skipped	0	77	DISCARD
2026-09-06	34017487805	s02	builder=failure reviewer=skipped	0	77	DISCARD
2026-09-07	34093201819	s02	builder=failure reviewer=skipped	0	77	DISCARD
2026-09-08	34196666164	s02	builder=failure reviewer=skipped	0	77	DISCARD
2026-09-09	34321852639	s02	builder=failure reviewer=skipped	0	77	DISCARD
2026-09-10	34447686675	s02	builder=failure reviewer=skipped	0	77	DISCARD
2026-09-11	34572218988	s02	Self-contained rewrite of s02 Terra sandbox client and expanded jest test suite covering all behaviors. 	72	77	DISCARD
2026-09-12	34679132960	s02	Self-contained rewrite of s02 sandbox client (connect/webhook/EventLog/batch/aggregation/schema) with full test coverage. 	59	77	DISCARD
2026-09-13	34744476362	s02	builder=failure reviewer=skipped	0	77	DISCARD
2026-09-14	34818273312	s02	builder=failure reviewer=skipped	0	77	DISCARD
2026-09-15	34940255706	s02	Self-contained rewrite of s02 Terra sandbox client and an expanded jest suite covering connections, webhooks, EventLog, and aggregation. 	64	77	DISCARD
2026-09-16	35067210861	s02	builder=failure reviewer=skipped	0	77	DISCARD
2026-09-17	35193014364	s02	Self-contained rewrite of s02 Terra sandbox client (connections, webhook validation, EventLog, batch ingest, aggregation) with full jest coverage. 	52	77	DISCARD
2026-09-18	35317409232	s02	builder=failure reviewer=skipped	0	77	DISCARD
2026-09-19	35428106979	s02	Self-contained rewrite of s02 Terra sandbox client and full jest test suite covering connect/webhook/log/batch/aggregation. 	63	77	DISCARD
2026-09-20	35496808542	s02	Add self-contained s02 pagination and multi-provider aggregation helpers with a new additive test suite. 	104	77	KEEP
2026-09-21	35573681783	s02	Add additive s02 exportFormat helpers (CSV/NDJSON/summary/filter/group) with a new self-contained jest suite. 	130	104	KEEP
2026-09-22	35698696644	s02	Add additive s02 rate limiter and retry-backoff queue modules with a new self-contained jest suite. 	149	130	DISCARD
2026-09-23	35831022301	s02	Add additive s02 webhook HMAC signature verification and wearable unit normalization helpers with a new self-contained jest suite. 	164	130	KEEP
2026-09-24	35968012615	s02	builder=failure reviewer=skipped	0	164	DISCARD
2026-09-25	36105891532	s02	builder=failure reviewer=skipped	0	164	DISCARD
2026-09-26	36225557856	s02	builder=failure reviewer=skipped	0	164	DISCARD
2026-09-27	36303466500	s02	builder=failure reviewer=skipped	0	164	DISCARD
2026-09-28	36395834546	s02	builder=failure reviewer=skipped	0	164	DISCARD
2026-09-29	36539095086	s02	builder=failure reviewer=skipped	0	164	DISCARD
2026-09-30	36686523765	s02	builder=failure reviewer=skipped	0	164	DISCARD
2026-10-01	36835287570	s02	builder=failure reviewer=skipped	0	164	DISCARD
2026-10-02	36981056412	s02	builder=failure reviewer=skipped	0	164	DISCARD
2026-10-03	37106713286	s02	builder=failure reviewer=skipped	0	164	DISCARD
2026-10-04	37186761773	s02	builder=failure reviewer=skipped	0	164	DISCARD
2026-10-05	37282599312	s02	builder=failure reviewer=skipped	0	164	DISCARD
2026-10-06	37436677527	s02	builder=failure reviewer=skipped	0	164	DISCARD
2026-10-07	37591646324	s02	builder=failure reviewer=skipped	0	164	DISCARD
2026-10-08	37749454045	s02	builder=failure reviewer=skipped	0	164	DISCARD
2026-10-09	37905009805	s02	builder=failure reviewer=skipped	0	164	DISCARD
2026-10-10	38036620501	s02	builder=failure reviewer=skipped	0	164	DISCARD
